[
  {
    "id": "noviceSword",
    "kind": "gear",
    "name": "목검",
    "name_en": null,
    "slot": "rod",
    "rarity": 0,
    "style": "physical",
    "set_name": "초보자",
    "tier": null,
    "type": "weapon",
    "flavor": null,
    "description": null,
    "effect_text": null,
    "affix": null,
    "boss": null,
    "stats": null,
    "source_hint": null,
    "tags": [
      "초보자",
      "무기"
    ]
  },
  {
    "id": "noviceStaff",
    "kind": "gear",
    "name": "나무 스태프",
    "name_en": null,
    "slot": "rod",
    "rarity": 0,
    "style": "magic",
    "set_name": "초보자",
    "tier": null,
    "type": "weapon",
    "flavor": null,
    "description": null,
    "effect_text": null,
    "affix": null,
    "boss": null,
    "stats": null,
    "source_hint": null,
    "tags": [
      "초보자",
      "무기"
    ]
  },
  {
    "id": "noviceRod",
    "kind": "gear",
    "name": "수련용 샤이닝 로드",
    "name_en": null,
    "slot": "rod",
    "rarity": 0,
    "style": "balanced",
    "set_name": "초보자",
    "tier": null,
    "type": "weapon",
    "flavor": null,
    "description": null,
    "effect_text": null,
    "affix": null,
    "boss": null,
    "stats": null,
    "source_hint": null,
    "tags": [
      "초보자",
      "무기"
    ]
  },
  {
    "id": "noviceArmor",
    "kind": "gear",
    "name": "하얀 반팔 면티",
    "name_en": null,
    "slot": "coat",
    "rarity": 0,
    "style": null,
    "set_name": "초보자",
    "tier": null,
    "type": "armor",
    "flavor": null,
    "description": null,
    "effect_text": null,
    "affix": null,
    "boss": null,
    "stats": null,
    "source_hint": null,
    "tags": [
      "초보자",
      "방어구"
    ]
  },
  {
    "id": "noviceCape",
    "kind": "gear",
    "name": "낡은 천 망토",
    "name_en": null,
    "slot": "cape",
    "rarity": 0,
    "style": null,
    "set_name": "초보자",
    "tier": null,
    "type": "armor",
    "flavor": null,
    "description": null,
    "effect_text": null,
    "affix": null,
    "boss": null,
    "stats": null,
    "source_hint": null,
    "tags": [
      "초보자",
      "망토"
    ]
  },
  {
    "id": "noviceCharm",
    "kind": "gear",
    "name": "나무 귀고리",
    "name_en": null,
    "slot": "charm",
    "rarity": 0,
    "style": null,
    "set_name": "초보자",
    "tier": null,
    "type": "accessory",
    "flavor": null,
    "description": null,
    "effect_text": null,
    "affix": null,
    "boss": null,
    "stats": null,
    "source_hint": null,
    "tags": [
      "초보자",
      "장신구"
    ]
  },
  {
    "id": "mapleSword",
    "kind": "gear",
    "name": "메이플 소드",
    "name_en": null,
    "slot": "rod",
    "rarity": 1,
    "style": "physical",
    "set_name": "메이플",
    "tier": null,
    "type": "weapon",
    "flavor": null,
    "description": null,
    "effect_text": null,
    "affix": null,
    "boss": null,
    "stats": null,
    "source_hint": null,
    "tags": [
      "메이플",
      "무기"
    ]
  },
  {
    "id": "mapleStaff",
    "kind": "gear",
    "name": "메이플 스태프",
    "name_en": null,
    "slot": "rod",
    "rarity": 1,
    "style": "magic",
    "set_name": "메이플",
    "tier": null,
    "type": "weapon",
    "flavor": null,
    "description": null,
    "effect_text": null,
    "affix": null,
    "boss": null,
    "stats": null,
    "source_hint": null,
    "tags": [
      "메이플",
      "무기"
    ]
  },
  {
    "id": "mapleRod",
    "kind": "gear",
    "name": "메이플 샤이닝 로드",
    "name_en": null,
    "slot": "rod",
    "rarity": 1,
    "style": "balanced",
    "set_name": "메이플",
    "tier": null,
    "type": "weapon",
    "flavor": null,
    "description": null,
    "effect_text": null,
    "affix": null,
    "boss": null,
    "stats": null,
    "source_hint": null,
    "tags": [
      "메이플",
      "무기"
    ]
  },
  {
    "id": "mapleArmor",
    "kind": "gear",
    "name": "메이플 아머",
    "name_en": null,
    "slot": "coat",
    "rarity": 1,
    "style": null,
    "set_name": "메이플",
    "tier": null,
    "type": "armor",
    "flavor": null,
    "description": null,
    "effect_text": null,
    "affix": null,
    "boss": null,
    "stats": null,
    "source_hint": null,
    "tags": [
      "메이플",
      "방어구"
    ]
  },
  {
    "id": "mapleCape",
    "kind": "gear",
    "name": "메이플 케이프",
    "name_en": null,
    "slot": "cape",
    "rarity": 1,
    "style": null,
    "set_name": "메이플",
    "tier": null,
    "type": "armor",
    "flavor": null,
    "description": null,
    "effect_text": null,
    "affix": null,
    "boss": null,
    "stats": null,
    "source_hint": null,
    "tags": [
      "메이플",
      "망토"
    ]
  },
  {
    "id": "mapleCharm",
    "kind": "gear",
    "name": "메이플 펜던트",
    "name_en": null,
    "slot": "charm",
    "rarity": 1,
    "style": null,
    "set_name": "메이플",
    "tier": null,
    "type": "accessory",
    "flavor": null,
    "description": null,
    "effect_text": null,
    "affix": null,
    "boss": null,
    "stats": null,
    "source_hint": null,
    "tags": [
      "메이플",
      "장신구"
    ]
  },
  {
    "id": "zakumSword",
    "kind": "gear",
    "name": "자쿰의 소드",
    "name_en": null,
    "slot": "rod",
    "rarity": 2,
    "style": "physical",
    "set_name": "자쿰",
    "tier": null,
    "type": "weapon",
    "flavor": null,
    "description": null,
    "effect_text": null,
    "affix": null,
    "boss": null,
    "stats": null,
    "source_hint": null,
    "tags": [
      "자쿰",
      "무기"
    ]
  },
  {
    "id": "zakumStaff",
    "kind": "gear",
    "name": "자쿰의 스태프",
    "name_en": null,
    "slot": "rod",
    "rarity": 2,
    "style": "magic",
    "set_name": "자쿰",
    "tier": null,
    "type": "weapon",
    "flavor": null,
    "description": null,
    "effect_text": null,
    "affix": null,
    "boss": null,
    "stats": null,
    "source_hint": null,
    "tags": [
      "자쿰",
      "무기"
    ]
  },
  {
    "id": "zakumRod",
    "kind": "gear",
    "name": "자쿰의 샤이닝 로드",
    "name_en": null,
    "slot": "rod",
    "rarity": 2,
    "style": "balanced",
    "set_name": "자쿰",
    "tier": null,
    "type": "weapon",
    "flavor": null,
    "description": null,
    "effect_text": null,
    "affix": null,
    "boss": null,
    "stats": null,
    "source_hint": null,
    "tags": [
      "자쿰",
      "무기"
    ]
  },
  {
    "id": "zakumArmor",
    "kind": "gear",
    "name": "자쿰의 투구",
    "name_en": null,
    "slot": "coat",
    "rarity": 2,
    "style": null,
    "set_name": "자쿰",
    "tier": null,
    "type": "armor",
    "flavor": null,
    "description": null,
    "effect_text": null,
    "affix": null,
    "boss": null,
    "stats": null,
    "source_hint": null,
    "tags": [
      "자쿰",
      "방어구"
    ]
  },
  {
    "id": "zakumCape",
    "kind": "gear",
    "name": "피에르의 망토",
    "name_en": null,
    "slot": "cape",
    "rarity": 2,
    "style": null,
    "set_name": "자쿰",
    "tier": null,
    "type": "armor",
    "flavor": null,
    "description": null,
    "effect_text": null,
    "affix": null,
    "boss": null,
    "stats": null,
    "source_hint": null,
    "tags": [
      "자쿰",
      "망토"
    ]
  },
  {
    "id": "zakumCharm",
    "kind": "gear",
    "name": "혼테일의 목걸이",
    "name_en": null,
    "slot": "charm",
    "rarity": 2,
    "style": null,
    "set_name": "자쿰",
    "tier": null,
    "type": "accessory",
    "flavor": null,
    "description": null,
    "effect_text": null,
    "affix": null,
    "boss": null,
    "stats": null,
    "source_hint": null,
    "tags": [
      "자쿰",
      "장신구"
    ]
  },
  {
    "id": "fafnirSword",
    "kind": "gear",
    "name": "파프니르 소드",
    "name_en": null,
    "slot": "rod",
    "rarity": 3,
    "style": "physical",
    "set_name": "파프니르",
    "tier": null,
    "type": "weapon",
    "flavor": null,
    "description": null,
    "effect_text": null,
    "affix": null,
    "boss": null,
    "stats": null,
    "source_hint": null,
    "tags": [
      "파프니르",
      "무기"
    ]
  },
  {
    "id": "fafnirStaff",
    "kind": "gear",
    "name": "파프니르 스태프",
    "name_en": null,
    "slot": "rod",
    "rarity": 3,
    "style": "magic",
    "set_name": "파프니르",
    "tier": null,
    "type": "weapon",
    "flavor": null,
    "description": null,
    "effect_text": null,
    "affix": null,
    "boss": null,
    "stats": null,
    "source_hint": null,
    "tags": [
      "파프니르",
      "무기"
    ]
  },
  {
    "id": "fafnirRod",
    "kind": "gear",
    "name": "파프니르 샤이닝 로드",
    "name_en": null,
    "slot": "rod",
    "rarity": 3,
    "style": "balanced",
    "set_name": "파프니르",
    "tier": null,
    "type": "weapon",
    "flavor": null,
    "description": null,
    "effect_text": null,
    "affix": null,
    "boss": null,
    "stats": null,
    "source_hint": null,
    "tags": [
      "파프니르",
      "무기"
    ]
  },
  {
    "id": "fafnirArmor",
    "kind": "gear",
    "name": "루타비스 슈트",
    "name_en": null,
    "slot": "coat",
    "rarity": 3,
    "style": null,
    "set_name": "파프니르",
    "tier": null,
    "type": "armor",
    "flavor": null,
    "description": null,
    "effect_text": null,
    "affix": null,
    "boss": null,
    "stats": null,
    "source_hint": null,
    "tags": [
      "파프니르",
      "방어구"
    ]
  },
  {
    "id": "fafnirCape",
    "kind": "gear",
    "name": "타일런트 히아데스 클록",
    "name_en": null,
    "slot": "cape",
    "rarity": 3,
    "style": null,
    "set_name": "파프니르",
    "tier": null,
    "type": "armor",
    "flavor": null,
    "description": null,
    "effect_text": null,
    "affix": null,
    "boss": null,
    "stats": null,
    "source_hint": null,
    "tags": [
      "파프니르",
      "망토"
    ]
  },
  {
    "id": "fafnirCharm",
    "kind": "gear",
    "name": "마이스터 링",
    "name_en": null,
    "slot": "charm",
    "rarity": 3,
    "style": null,
    "set_name": "파프니르",
    "tier": null,
    "type": "accessory",
    "flavor": null,
    "description": null,
    "effect_text": null,
    "affix": null,
    "boss": null,
    "stats": null,
    "source_hint": null,
    "tags": [
      "파프니르",
      "장신구"
    ]
  },
  {
    "id": "absolabSword",
    "kind": "gear",